{
  "baseline": {
    "scope": "Current Architecture Exploration Methodology research artifacts only; no canonical, API, MCP, migration, relation, production, or paper changes.",
    "source_ref": "origin/main after PR #74 merge",
    "source_revision": "2308f260547e3a618d5498fc4038cef9a297e2b8"
  },
  "canonical": false,
  "index_id": "mth-0201-reproducibility-index",
  "package_sources": [
    {
      "digest": "sha256:52e942bf89bfb92caa4f6ab07686af396dc6cd2c944b5c8c3445bcf01ceb3076",
      "path": "schemas/reproducibility-index.schema.json",
      "present": true
    },
    {
      "digest": "sha256:1cfb867376358d05fe74124eca036e80f8baa8ef0847448093c2e4d4f3bda448",
      "path": "scripts/build_mth0201_reproducibility_index.py",
      "present": true
    },
    {
      "digest": "sha256:061769231fbeea52d11907eac9b1af7bbea1f1675e522a2bcb7cfc31e447d720",
      "path": "docs/mth-0201-reproducibility-index.md",
      "present": true
    }
  ],
  "promotion_boundary": {
    "human_review_required": true,
    "inference_allowed": false,
    "promotion_decision": "not-determined"
  },
  "research_only": true,
  "schema_version": "1.0",
  "work_items": [
    {
      "boundary": {
        "canonical": false,
        "inference_allowed": false,
        "promotion_decision": "not-determined",
        "research_only": true,
        "review_state": "under-review"
      },
      "commands": [
        {
          "command": "python scripts/exploration_benchmark.py",
          "kind": "regenerate",
          "reason": "The MTH-0169 fixture and builder are historical artifacts and are not present on the baseline.",
          "status": "unavailable"
        },
        {
          "command": "python scripts/exploration_benchmark.py --validate data/benchmark/mth-0169-exploration.json",
          "kind": "validate",
          "reason": "The historical validator cannot run without the absent script.",
          "status": "unavailable"
        }
      ],
      "environment_assumptions": [
        "Commands are offline and run from the repository root.",
        "Paths and digests refer to the checked-in origin/main baseline; absent files are not reconstructed.",
        "Historical protocol used deterministic normalized token overlap and an offline authored fixture."
      ],
      "files": [
        {
          "digest": null,
          "path": "data/benchmark/mth-0169-exploration.json",
          "present": false
        },
        {
          "digest": null,
          "path": "schemas/exploration-benchmark.schema.json",
          "present": false
        },
        {
          "digest": null,
          "path": "scripts/exploration_benchmark.py",
          "present": false
        },
        {
          "digest": null,
          "path": "docs/mth-0170-exploration-benchmark.md",
          "present": false
        }
      ],
      "id": "MTH-0169",
      "limitations": [
        "The record is research-only and does not promote evidence or infer an unmeasured result.",
        "The indexed artifact remains bounded by its own protocol and source revision.",
        "Historical files are indexed as absent rather than copied from old commits."
      ],
      "observations": [
        {
          "name": "empirical benchmark result",
          "scope": "No model output or reviewer labels are present in the historical fixture.",
          "status": "not-evaluated"
        },
        {
          "name": "direct-LLM condition",
          "scope": "No exact provider, model, prompt, runtime, or output provenance.",
          "status": "not-evaluated"
        }
      ],
      "provenance": {
        "direct_llm_status": "not-evaluated",
        "human_review": false,
        "human_stratum": "not-applicable",
        "reviewer_kind": "not-applicable"
      },
      "status": "not-present",
      "title": "Architecture exploration benchmark fixture"
    },
    {
      "boundary": {
        "canonical": false,
        "inference_allowed": false,
        "promotion_decision": "not-determined",
        "research_only": true,
        "review_state": "under-review"
      },
      "commands": [
        {
          "command": "python scripts/evaluate_exploration.py",
          "kind": "regenerate",
          "reason": "The MTH-0172 evaluator and result are not present on the baseline.",
          "status": "unavailable"
        },
        {
          "command": "PYTHONPATH=src uv run python -m unittest tests.test_evaluate_exploration -v",
          "kind": "validate",
          "reason": "The historical test is not present on the baseline.",
          "status": "unavailable"
        }
      ],
      "environment_assumptions": [
        "Commands are offline and run from the repository root.",
        "Paths and digests refer to the checked-in origin/main baseline; absent files are not reconstructed.",
        "Historical fixture compared bounded lexical discovery with authored evidence-bounded records."
      ],
      "files": [
        {
          "digest": null,
          "path": "data/benchmark/mth-0172-candidate-quality.json",
          "present": false
        },
        {
          "digest": null,
          "path": "scripts/evaluate_exploration.py",
          "present": false
        },
        {
          "digest": null,
          "path": "docs/mth-0172-candidate-quality.md",
          "present": false
        }
      ],
      "id": "MTH-0172",
      "limitations": [
        "The record is research-only and does not promote evidence or infer an unmeasured result.",
        "The indexed artifact remains bounded by its own protocol and source revision.",
        "Historical documentation must not be treated as a current checked-in result."
      ],
      "observations": [
        {
          "name": "authored fixture metrics",
          "scope": "The current checkout contains no MTH-0172 result to measure.",
          "status": "not-evaluated"
        },
        {
          "name": "direct-LLM condition",
          "scope": "No direct model run was supplied.",
          "status": "not-evaluated"
        }
      ],
      "provenance": {
        "direct_llm_status": "not-evaluated",
        "human_review": false,
        "human_stratum": "not-applicable",
        "reviewer_kind": "not-applicable"
      },
      "status": "not-present",
      "title": "Candidate discovery quality fixture evaluation"
    },
    {
      "boundary": {
        "canonical": false,
        "inference_allowed": false,
        "promotion_decision": "not-determined",
        "research_only": true,
        "review_state": "under-review"
      },
      "commands": [
        {
          "command": "python scripts/expand_exploration_benchmark.py",
          "kind": "regenerate",
          "reason": "The MTH-0174 task set and builder are absent from the baseline.",
          "status": "unavailable"
        },
        {
          "command": "python scripts/expand_exploration_benchmark.py --validate data/benchmark/mth-0174-cross-system.json",
          "kind": "validate",
          "reason": "The historical validator cannot run without the absent files.",
          "status": "unavailable"
        }
      ],
      "environment_assumptions": [
        "Commands are offline and run from the repository root.",
        "Paths and digests refer to the checked-in origin/main baseline; absent files are not reconstructed.",
        "Historical task set was authored, offline, and split into train/evaluation/holdout partitions."
      ],
      "files": [
        {
          "digest": null,
          "path": "data/benchmark/mth-0174-cross-system.json",
          "present": false
        },
        {
          "digest": null,
          "path": "schemas/expanded-exploration-benchmark.schema.json",
          "present": false
        },
        {
          "digest": null,
          "path": "scripts/expand_exploration_benchmark.py",
          "present": false
        },
        {
          "digest": null,
          "path": "docs/mth-0174-cross-system-benchmark.md",
          "present": false
        }
      ],
      "id": "MTH-0174",
      "limitations": [
        "The record is research-only and does not promote evidence or infer an unmeasured result.",
        "The indexed artifact remains bounded by its own protocol and source revision.",
        "Repeated task keys were not independent measurements or statistical power."
      ],
      "observations": [
        {
          "name": "task-set result",
          "scope": "Task capacity is not an empirical quality result.",
          "status": "not-evaluated"
        },
        {
          "name": "direct-LLM condition",
          "scope": "No model provenance or output.",
          "status": "not-evaluated"
        }
      ],
      "provenance": {
        "direct_llm_status": "not-evaluated",
        "human_review": false,
        "human_stratum": "not-applicable",
        "reviewer_kind": "not-applicable"
      },
      "status": "not-present",
      "title": "Cross-system exploration task set"
    },
    {
      "boundary": {
        "canonical": false,
        "inference_allowed": false,
        "promotion_decision": "not-determined",
        "research_only": true,
        "review_state": "under-review"
      },
      "commands": [
        {
          "command": "uv run python scripts/reviewer_study.py generate <tasks.json> --output <study.json> --study-id mth-0175-example --assignment-seed <seed>",
          "kind": "regenerate",
          "status": "available"
        },
        {
          "command": "uv run python scripts/reviewer_study.py validate data/research-review/mth-0175-study.json",
          "kind": "validate",
          "status": "available"
        },
        {
          "command": "PYTHONPATH=src uv run python -m unittest tests.test_reviewer_pilot -v",
          "kind": "test",
          "status": "available"
        }
      ],
      "environment_assumptions": [